Question,Answer,Category,Difficulty
What is the importance of regular data backups?,"Regular data backups are essential for protecting against data loss due to hardware failure, software corruption, or human error. Backups provide a point of recovery in case of a disaster, allowing you to restore your data and minimize downtime. Use a combination of local and cloud backups, and test your backups regularly to ensure they are complete and recoverable. This will help you maintain business continuity and minimize the impact of data loss.",Data Backup and Recovery,Basic
What are some best practices for mobile device security?,"To secure mobile devices, use strong passwords, enable two-factor authentication (2FA), and regularly update your operating system and apps. Install reputable anti-virus software and use a firewall to block unauthorized access. Be cautious when downloading apps and avoid using public Wi-Fi for sensitive activities. Use encryption to protect data, and consider implementing a mobile device management (MDM) solution to monitor and control device usage.",Mobile Security,Intermediate
What is the difference between a firewall and an antivirus program?,"A firewall is a network security system that monitors and controls incoming and outgoing network traffic based on predetermined security rules. An antivirus program, on the other hand, is designed to detect, prevent, and remove malware from a computer. While both are essential for cybersecurity, they serve different purposes and are not mutually exclusive. A firewall provides network protection, whereas an antivirus program protects individual devices.",Network Security,Intermediate
How do I create a strong password for my online accounts?,"To create a strong password, use a combination of uppercase and lowercase letters, numbers, and special characters. Avoid using easily guessable information such as your name, birthdate, or common words. Use a password manager to generate and store unique, complex passwords for each account. Make sure to change your passwords regularly and enable two-factor authentication (2FA) for an additional layer of security.",Authentication,Basic
What is phishing and how can I protect myself from it?,"Phishing is a type of cyberattack where an attacker sends fake emails, messages, or websites that appear legitimate but are designed to steal sensitive information such as passwords or financial data. To protect yourself from phishing, be cautious when clicking on links or downloading attachments from unknown sources. Verify the authenticity of emails and websites by checking for spelling and grammar errors, as well as the sender's email address. Use strong antivirus software and a reputable security suite to detect and block phishing attempts. Never provide sensitive information via email or text message.",Incident Response,Intermediate
How often should I back up my computer data?,"It is essential to back up your computer data regularly to prevent data loss in case of a system failure or cyberattack. Aim to back up your data at least once a week, or more frequently if you work with critical or sensitive information. Use an automated backup system to ensure your data is up to date, and store backups in a secure location such as an external hard drive or cloud storage service. Consider using a backup strategy that includes both full and incremental backups to ensure data integrity.",Data Backup and Recovery,Basic
What is the difference between a virus and a worm?,"A virus is a type of malware that replicates itself by attaching to other programs or files, whereas a worm is a type of malware that can spread from system to system without the need for human interaction. Both viruses and worms can cause harm to a computer or network, but worms are more insidious because they can spread quickly and stealthily. Use antivirus software to detect and remove both viruses and worms, and ensure your operating system and software are up to date to prevent exploitation.",Malware Protection,Intermediate
How do I protect my mobile device from cyber threats?,"To protect your mobile device, enable a screen lock with a strong password or PIN, install a reputable antivirus app, and keep your operating system and apps up to date. Be cautious when downloading apps and only install them from trusted sources. Use a VPN to secure your internet connection, especially when using public Wi-Fi. Regularly back up your data and use a cloud storage service to ensure it's secure in case your device is lost or stolen. Disable Bluetooth and Wi-Fi when not in use to prevent unauthorized access.",Mobile Security,Basic
How do I prevent phishing attacks on my company's email?,"To prevent phishing attacks, educate employees on how to identify suspicious emails, use email filters and antivirus software, implement a secure email gateway, and use two-factor authentication. Regularly update software and operating systems, and provide ongoing security awareness training to employees.",Incident Response,Intermediate
What are the best practices for securing my company's mobile devices?,"To secure mobile devices, use a mobile device management (MDM) solution, implement a mobile application management (MAM) policy, use strong passwords and enable biometric authentication, and ensure devices are running the latest operating system and security patches. Regularly monitor and update mobile security software, and use a secure email client.",Mobile Security,Intermediate
How do I create a secure password policy for my company?,"To create a secure password policy, require strong and unique passwords, implement a password manager, and use multi-factor authentication. Limit password reuse, use password expiration policies, and enforce regular password updates. Consider using a passwordless authentication method for added security.",Authentication,Basic
What steps should I take to respond to a ransomware attack?,"To respond to a ransomware attack, immediately isolate the affected system, disconnect from the network, and preserve evidence. Contact your incident response team and report the incident to law enforcement. Use backup data to restore systems, and consider hiring a professional to help with the recovery process. Update security software and patches, and implement additional security measures to prevent future attacks.",Incident Response,Advanced
How do I protect my company's data in case of a disaster?,"To protect data in case of a disaster, use a secure data backup and recovery plan, store backups in a secure location, and use cloud storage for offsite backup. Regularly test and update backups, and use version control to track changes. Consider using a disaster recovery as a service (DRaaS) solution for added protection.",Data Backup and Recovery,Intermediate
What are the best practices for securing my company's network?,"To secure your company's network, use a firewall, implement a network access control (NAC) policy, and use intrusion detection and prevention systems (IDPS). Regularly update and patch network devices, and use secure protocols for remote access. Limit network access to essential personnel, and use encryption for sensitive data.",Network Security,Intermediate
How do I detect and respond to a malware attack?,"To detect and respond to a malware attack, use antivirus software, implement a sandbox for unknown files, and use a security information and event management (SIEM) system. Regularly monitor network traffic and system logs, and use threat intelligence to stay informed about emerging threats. Isolate infected systems, and use a response plan to contain and eradicate the malware.",Malware Protection,Intermediate
What is the best way to protect against phishing attacks?,"To protect against phishing attacks, employees should be cautious when receiving emails with suspicious links or attachments. They should verify the sender's email address and check for spelling mistakes or generic greetings. Be cautious of urgent or threatening messages that ask for sensitive information. Use antivirus software and a reputable email client to filter out spam and phishing emails. Regularly update your operating system and software to ensure you have the latest security patches. Educate employees on how to identify and report phishing attempts to prevent cyber threats.",Incident Response,Intermediate
How do I update my antivirus software to ensure my device is secure?,"To update your antivirus software, open the antivirus program and click on the 'Update' or 'Check for updates' button. You can also set your antivirus software to automatically update in the background. Ensure your antivirus software is set to update its virus definitions regularly to stay protected against the latest threats. Consider using a reputable antivirus software that provides real-time protection and automatic updates. Make sure to restart your device after updating to ensure the changes take effect.",Malware Protection,Basic
What should I do if my device is infected with malware?,"If your device is infected with malware, disconnect it from the internet immediately to prevent further damage. Run a full scan using your antivirus software to detect and remove the malware. Update your operating system and software to ensure you have the latest security patches. Consider using a reputable antivirus software that provides a 'Safe Mode' feature to safely remove malware. If the malware is persistent, consider seeking the help of a professional or a cybersecurity expert to safely remove it. Remember to regularly back up your data to prevent data loss in case of a malware infection.",Malware Protection,Intermediate
How do I create a secure password for my online accounts?,"To create a secure password, use a combination of uppercase and lowercase letters, numbers, and special characters. Avoid using easily guessable information such as your name, birthdate, or common words. Use a password manager to generate and store unique, complex passwords for each account. Change your passwords regularly, ideally every 60-90 days, and avoid reusing passwords across multiple accounts. Use two-factor authentication (2FA) whenever possible to add an extra layer of security.",Authentication,Basic
What is the best way to back up my data in case of a disaster?,"To back up your data, use a combination of local and cloud-based backups. Use an external hard drive or NAS to store local backups of your important files. Use a cloud-based backup service such as Dropbox or Google Drive to store your files online. Consider using a backup software that provides automatic backups and versioning to ensure you have a history of your files. Regularly test your backups to ensure they are complete and restorable. Consider using a backup service that provides a 'three-2-1' rule: three copies of your data, two local and one offsite.",Data Backup and Recovery,Intermediate
What are the best practices for securing my mobile device?,"To secure your mobile device, use a strong password or PIN to lock your device. Enable two-factor authentication (2FA) to add an extra layer of security. Keep your operating system and apps up to date with the latest security patches. Use a reputable antivirus app to scan for malware and other threats. Be cautious when installing apps, especially those that request sensitive permissions. Regularly back up your data to a secure location, such as a cloud-based service. Use a VPN when connecting to public Wi-Fi networks to encrypt your internet traffic.",Mobile Security,Intermediate
How do I identify a ransomware attack on my network?,"To identify a ransomware attack, look for signs such as slow network performance, unusual network activity, and files or folders with unusual names or extensions. Check for ransomware-specific files such as.locky or.bitcoin. Monitor for suspicious emails or messages from unknown senders. Use antivirus software and a reputable security information and event management (SIEM) system to detect and alert on potential threats. Regularly back up your data to a secure location, such as a cloud-based service, to prevent data loss in case of a ransomware attack.",Incident Response,Intermediate
What is the best way to secure my home Wi-Fi network?,"To secure your home Wi-Fi network, change the default router password, enable WPA3 encryption, update the firmware regularly, and create a guest network for visitors. Use strong passwords and disable WPS to prevent unauthorized access. Set up a firewall to block incoming and outgoing traffic. Regularly update your router's firmware to ensure you have the latest security patches. Use a reputable antivirus software to scan for malware and other threats. Consider using a VPN to encrypt your internet traffic when using public Wi-Fi networks.",Network Security,Intermediate
How do I prevent social engineering attacks?,"To prevent social engineering attacks, educate employees on how to identify and report phishing attempts. Use social engineering-specific security awareness training to educate employees on the tactics used by attackers. Implement a 'zero-trust' policy to assume all users are potential threats. Use multi-factor authentication (MFA) to add an extra layer of security. Regularly review and update your security policies and procedures to ensure they are effective. Use a reputable security information and event management (SIEM) system to detect and alert on potential threats.",Incident Response,Intermediate
What are the best practices for updating software?,"To update software, check for updates regularly, enable automatic updates, and verify the authenticity of the update source. Be cautious when installing updates from untrusted sources, and always read the release notes to understand the changes.",Malware Protection,Intermediate
What are the best practices for updating and patching my operating system?,"Regularly check for updates and install them as soon as possible. Enable automatic updates for the operating system and applications. This will help ensure that security vulnerabilities are patched and prevent potential exploits. Additionally, use a reputable antivirus software to scan for any malware or other potential threats before installing updates.",Malware Protection,Intermediate
How do I securely delete sensitive files?,"To securely delete files, use a secure deletion tool that overwrites the data multiple times to prevent recovery. Use the Windows built-in command prompt or a third-party tool like DBAN to securely erase the files. Do not simply move them to the recycle bin or use the delete function, as this may not completely remove the data. Additionally, consider using a secure file shredder for extra security.",Data Backup and Recovery,Advanced
What is the difference between a firewall and an antivirus program?,"A firewall monitors incoming and outgoing network traffic, blocking unauthorized access to a computer or network. An antivirus program scans files for malware and other threats. Both are essential for protecting a system, but they serve different purposes. A firewall should be enabled by default, and an antivirus program should be updated regularly to stay effective.",Network Security,Basic
How can I identify and remove malware from my system?,"Identify the type of malware using a reputable antivirus tool. Run a full scan of the system to locate the malware. Isolate the infected system to prevent further spread. Use the antivirus tool to quarantine or remove the malware. If the malware is particularly stubborn, consider seeking the help of a cybersecurity professional. Regularly back up important data to prevent data loss in case of a malware attack.",Incident Response,Intermediate
What are some best practices for creating strong passwords?,"Use a combination of uppercase and lowercase letters, numbers, and special characters to create strong passwords. Avoid using easily guessable information like names or birthdates. Use a password manager to securely store and generate unique passwords for each account. Change passwords regularly, ideally every 60-90 days, and use two-factor authentication whenever possible.",Authentication,Basic
How can I protect my mobile device from cyber threats?,"Use a secure lock screen, enable two-factor authentication, and install a reputable antivirus app. Regularly update the operating system and apps to patch security vulnerabilities. Use a secure Wi-Fi network or a VPN when accessing public networks. Avoid installing suspicious apps, and be cautious when clicking on links or downloading attachments from unknown sources. Regularly back up important data to prevent data loss in case of a device loss or theft.",Mobile Security,Intermediate
What is the purpose of a firewall in network security?,"A firewall is a network security system that monitors and controls incoming and outgoing network traffic based on predetermined security rules. It acts as a barrier between a trusted network and an untrusted network, such as the internet, to prevent unauthorized access and malicious activity.",Network Security,Basic
What is the purpose of a firewall in network security?,"A firewall is a network security system that monitors and controls incoming and outgoing network traffic based on predetermined security rules. It acts as a barrier between a trusted network and an untrusted network, such as the internet, to prevent unauthorized access, malicious traffic, and other potential security threats. Firewalls can be hardware-based or software-based and are typically configured to block specific IP addresses, ports, or protocols. By blocking malicious traffic, firewalls help protect against hacking, malware, and other cyber threats.",Network Security,Basic
How do I prevent phishing attacks?,"To prevent phishing attacks, employees should be cautious when receiving emails or messages that request sensitive information or ask them to click on links or download attachments. Legitimate organizations will never ask for sensitive information via email or text message. Employees should verify the authenticity of the request by contacting the sender directly and avoid clicking on suspicious links or downloading attachments from unknown sources. They should also keep their software and browsers up to date and use strong, unique passwords for all accounts. Employees should also be aware of the common tactics used by phishers, such as using urgent or threatening language, and report any suspicious activity to the IT department.",Incident Response,Intermediate
What is the difference between a Trojan and a virus?,"A Trojan and a virus are both types of malware, but they serve different purposes. A virus is a self-replicating program that attaches itself to other programs and can cause harm by deleting or corrupting data. A Trojan, on the other hand, is a type of malware that disguises itself as a legitimate program but actually allows an attacker to access a system remotely. While a virus can cause harm directly, a Trojan is used to provide unauthorized access to a system. Both types of malware can be spread through infected software downloads, email attachments, or infected websites.",Malware Protection,Intermediate
How do I implement a password policy for my company?,"To implement a password policy for your company, you should establish a set of rules that govern password creation, storage, and usage. This includes requiring strong, unique passwords for all employees, using a password manager to securely store passwords, and implementing multi-factor authentication (MFA) to add an extra layer of security. You should also set a password expiration policy to ensure that passwords are changed regularly, use a password history to prevent reuse, and enforce password complexity requirements such as a minimum length and character types. Additionally, you should educate employees on best practices for creating and managing passwords.",Authentication,Advanced
What is the importance of regular software updates?,"Regular software updates are crucial for maintaining the security and stability of your systems and applications. Updates often include patches for vulnerabilities that have been discovered by security researchers, which can be exploited by attackers to gain unauthorized access. By applying these updates, you can protect your systems from potential threats and prevent data breaches. Additionally, updates may also include new features, performance improvements, and bug fixes that can improve the overall user experience. It is essential to prioritize software updates and apply them as soon as possible to minimize the risk of security breaches and ensure the smooth operation of your systems.",Data Backup and Recovery,Basic
What are the best practices for password management in a business environment?,"To ensure strong password management, businesses should implement a password policy that requires employees to use a minimum of 12 characters, includes a mix of uppercase and lowercase letters, numbers, and special characters. Employees should also change their passwords every 60 days, and use a password manager to store and generate complex passwords. Additionally, consider implementing a multi-factor authentication (MFA) system to provide an extra layer of security.",Authentication,Intermediate
What is the difference between a firewall and an antivirus program?,"A firewall is a network security system that monitors and controls incoming and outgoing network traffic based on predetermined security rules. An antivirus program, on the other hand, is designed to detect, prevent, and remove malware from a computer or network. While both are essential security tools, they serve different purposes. Firewalls are primarily used to prevent unauthorized access to or from a network, whereas antivirus software focuses on detecting and eliminating malware.",Network Security,Intermediate
How can I prevent phishing attacks?,"To prevent phishing attacks, be cautious when clicking on links or opening attachments from unknown sources. Verify the authenticity of emails and messages by contacting the sender directly. Use strong, unique passwords and enable two-factor authentication (2FA) to add an extra layer of security. Keep your operating system, browser, and software up-to-date with the latest security patches. Use a reputable antivirus program and a firewall to block malicious activity. Educate yourself and others about phishing tactics and stay informed about the latest threats.",Incident Response,Basic
What is the importance of regular software updates?,"Regular software updates are crucial for maintaining the security and stability of your computer or network. Updates often include patches for known vulnerabilities, which can be exploited by attackers to gain unauthorized access. By keeping your software up-to-date, you can ensure that you have the latest security patches and features, reducing the risk of malware infections and other security threats. Additionally, updates can improve system performance, fix bugs, and enhance user experience.",Data Backup and Recovery,Intermediate
How can I protect my mobile device from malware?,"To protect your mobile device from malware, use a reputable antivirus app, install security software that scans for malware, and avoid downloading apps from untrusted sources. Enable Google Play Protect (for Android) or Screen Time (for iOS) to monitor and limit app installations. Keep your operating system and apps up-to-date with the latest security patches. Use a strong password and enable 2FA to prevent unauthorized access. Be cautious when clicking on links or opening attachments from unknown sources.",Mobile Security,Basic
What is the difference between a password and a passphrase?,"A password is a sequence of characters used to access a system, account, or application. A passphrase, on the other hand, is a sequence of words or phrases used as a password. Passphrases are often more secure than passwords because they are easier to remember and less susceptible to brute-force attacks. However, they can be more prone to phishing attacks if not used correctly. A good passphrase should be at least 12 characters long, use a mix of uppercase and lowercase letters, numbers, and special characters, and avoid common words or phrases.",Authentication,Intermediate
How do I recover from a ransomware attack?,"To recover from a ransomware attack, disconnect from the internet to prevent further encryption. Immediately contact your IT department or a cybersecurity professional for assistance. Use a backup to restore your data, if available. If not, you may need to use data recovery software to attempt to restore your files. Keep in mind that paying the ransom is not recommended, as it may not guarantee the safe return of your data. Implement a robust backup strategy, including regular backups and a disaster recovery plan, to prevent future attacks.",Incident Response,Advanced
What is the role of a vulnerability scanner in cybersecurity?,"A vulnerability scanner is a tool that scans a network, system, or application for known vulnerabilities, misconfigurations, and other security weaknesses. It helps identify potential entry points that attackers could exploit to gain unauthorized access. The scanner can also provide recommendations for remediation, allowing you to patch or fix the identified vulnerabilities. Regularly scanning for vulnerabilities is essential to maintain a secure environment and prevent potential attacks.",Network Security,Intermediate
