Question,Answer,Category,Difficulty
What are the common types of malware and how can I protect against them?,"Malware can be categorized into three primary types: viruses, Trojan horses, and ransomware. Viruses replicate and spread by attaching themselves to other programs, while Trojan horses disguise themselves as legitimate software. Ransomware encrypts files and demands payment in exchange for the decryption key. To protect against malware, keep your operating system and software up-to-date, use antivirus software, avoid suspicious links and attachments, and use strong passwords. Also, use a reputable security suite that includes anti-malware protection, a firewall, and a VPN to safeguard your network connections.",Malware Protection,Intermediate
How do I properly dispose of old electronics to prevent data breaches?,"When disposing of old electronics, ensure you erase all data stored on the device. Use a reputable data erasure tool or physically destroy the storage media. Then, recycle the device responsibly through a certified electronic waste recycling facility. This prevents sensitive information from falling into the wrong hands and reduces the risk of data breaches. Additionally, remove any removable storage devices, such as SIM cards and SD cards, and dispose of them securely. Consider using a degaussing machine to demagnetize hard drives for extra security.",Data Backup and Recovery,Basic
What are the key components of a comprehensive incident response plan?,"A comprehensive incident response plan should include six key components: preparation, detection, response, containment, eradication, and recovery. Preparation involves identifying potential threats, developing a response strategy, and establishing a team to handle incidents. Detection involves monitoring for security breaches, while response involves notifying stakeholders and activating the response team. Containment and eradication involve isolating and removing the threat, while recovery involves restoring systems and services to normal operations. Regular training and testing of the plan are crucial to ensure its effectiveness.",Incident Response,Intermediate
How can I ensure secure data backup and recovery for my business?,"To ensure secure data backup and recovery, implement a three-tier backup strategy: on-site, off-site, and cloud-based backups. Use a reputable backup software that includes encryption, compression, and versioning. Store backups in a secure, off-site location, such as a cloud storage service, to protect against physical damage or data breaches. Regularly test backups to ensure data integrity and restore them in case of a disaster. Consider implementing a backup rotation policy to ensure data is not lost due to hardware failure or human error.",Data Backup and Recovery,Advanced
What are the best practices for creating strong passwords?,"To create strong passwords, use a combination of uppercase and lowercase letters, numbers, and special characters. Avoid using easily guessable information such as your name, birthdate, or common words. Use a passphrase that is easy for you to remember but difficult for others to guess. Change your passwords regularly, ideally every 60-90 days, and avoid using the same password across multiple accounts. Consider using a password manager to generate and store unique, complex passwords for each account.",Authentication,Basic
What are the best practices for password management?,"To maintain strong passwords, use a combination of uppercase and lowercase letters, numbers, and special characters. Change your passwords every 60-90 days and store them securely using a password manager. Avoid using the same password across multiple accounts.",Authentication,Intermediate
What are the best practices for creating a strong password?,"A strong password should be at least 12 characters long, include a mix of uppercase and lowercase letters, numbers, and special characters. It should also be unique and not easily guessable. Consider using a passphrase or a password manager to generate and store unique, complex passwords for each account.",Authentication,Basic
How do I use a VPN to protect my data when working remotely?,"To use a VPN, download and install a reputable VPN client on your device. Create an account with a VPN service provider and connect to a server in your region or a country with strong internet security laws. This will encrypt your internet traffic and protect your data from being intercepted or monitored by unauthorized parties.",Network Security,Intermediate
What steps can I take to prevent malware from spreading through my organization?,"To prevent malware from spreading, keep your operating system, software, and apps up-to-date with the latest security patches. Use an antivirus program and a firewall to block malicious activity. Educate employees on safe computing practices, such as avoiding suspicious emails and attachments, and use a secure email gateway to filter out malicious emails. Regularly back up your data and consider implementing a data backup and disaster recovery plan.",Malware Protection,Advanced
How do I handle a ransomware attack on our company network?,"In the event of a ransomware attack, disconnect the affected system from the network immediately to prevent further spread. Notify your IT team and relevant authorities, and assess the damage to determine the scope of the attack. Consider using a ransomware decryption tool or seeking the help of a cybersecurity expert. Restore your data from backups and take steps to prevent future attacks, such as implementing a robust backup and disaster recovery plan, and educating employees on safe computing practices.",Incident Response,Advanced
What are the benefits of regular data backups?,"Regular data backups ensure business continuity and minimize data loss in the event of a disaster or cyberattack. Backups can be used to recover data, applications, and systems, reducing downtime and minimizing the financial impact of a disaster. Regular backups also provide a safety net for data that may be accidentally deleted or corrupted, allowing you to recover it quickly and efficiently.",Data Backup and Recovery,Basic
How can I secure my mobile device from cyber threats?,"To secure your mobile device, use a strong lock screen password or PIN, enable two-factor authentication, and keep your operating system and apps up-to-date. Use a reputable antivirus app and a firewall to block malicious activity. Be cautious when downloading and installing apps, and avoid using public Wi-Fi for sensitive activities. Regularly back up your data and consider using a mobile device management (MDM) solution to monitor and control access to your device.",Mobile Security,Intermediate
What is the best way to protect against phishing attacks in the workplace?,"To protect against phishing attacks, educate employees on identifying suspicious emails and provide training on the company's security policies. Use email filters to block malicious emails and consider implementing a secure email gateway. Encourage employees to report any suspicious emails to the IT department. Also, ensure that employees are using strong, unique passwords for all accounts and enable multi-factor authentication (MFA) whenever possible. ",Incident Response,Intermediate
How can I secure my organization's sensitive data when using cloud storage?,"When using cloud storage, ensure that sensitive data is encrypted both in transit and at rest. Use a secure cloud storage provider that has robust security features, such as access controls and data loss prevention policies. Limit access to sensitive data to only those who need it, and use role-based access control to restrict permissions. Regularly review and update access controls to ensure they are still aligned with your organization's needs. ",Data Backup and Recovery,Advanced
"What is the difference between a firewall and a router, and how do they help with network security?","A firewall is a network security system that monitors and controls incoming and outgoing network traffic based on predetermined security rules. A router is a device that connects multiple networks together and routes traffic between them. Both firewalls and routers help with network security by blocking unauthorized access to the network and controlling traffic flow. Firewalls can be hardware-based or software-based, and can be configured to block specific types of traffic or malicious IP addresses. Routers can be configured to block traffic from certain sources or destinations, and can also be used to create a guest network for visitors. ",Network Security,Intermediate
How can I prevent malware from infecting my organization's devices?,"To prevent malware from infecting your organization's devices, use anti-virus software that is up-to-date and capable of detecting and removing malware. Ensure that all devices are patched regularly to prevent exploitation of known vulnerabilities. Use strong passwords and enable multi-factor authentication (MFA) to prevent unauthorized access to devices. Limit user privileges to prevent users from installing software or making changes to the system. Use a secure email gateway to block malicious emails and use a web application firewall (WAF) to protect against web-based attacks. ",Malware Protection,Advanced
What are the best practices for backing up and recovering data in case of a disaster?,"To ensure business continuity in case of a disaster, implement a comprehensive data backup and recovery plan. Use a combination of local and cloud-based backups to ensure data is safe in case of a disaster. Use a backup software that can handle large amounts of data and is easy to use. Test your backups regularly to ensure they are recoverable. Consider using a backup service that provides versioning and snapshots to ensure you can recover data from a specific point in time. ",Data Backup and Recovery,Intermediate
How can I secure my organization's mobile devices?,"To secure your organization's mobile devices, use a mobile device management (MDM) system to enforce security policies and ensure devices are up-to-date. Use strong passwords and enable multi-factor authentication (MFA) to prevent unauthorized access. Use a mobile antivirus software that can detect and remove malware. Limit user privileges to prevent users from installing apps or making changes to the device. Use a secure email gateway to block malicious emails and use a web application firewall (WAF) to protect against web-based attacks. ",Mobile Security,Intermediate
What is the primary purpose of a firewall in network security?,"A firewall is a network security system that monitors and controls incoming and outgoing network traffic based on predetermined security rules. It acts as a barrier between a trusted network and an untrusted network, such as the internet, to prevent unauthorized access, malicious traffic, and data breaches. Firewalls can be hardware-based or software-based and are an essential component of a comprehensive network security strategy.",Network Security,Intermediate
What is the best way to protect my company's network from a ransomware attack?,"To protect your company's network from a ransomware attack, ensure you have a robust backup and disaster recovery plan in place. Regularly update your software and operating systems, and use antivirus software that includes anti-ransomware protection. Implement a firewall and configure it to block suspicious activity. Educate employees on safe browsing habits and phishing attacks. Use a secure email gateway and enable two-factor authentication (2FA) for all users. Regularly back up critical data and keep backups offline to prevent loss in case of an attack.",Incident Response,Advanced
What are the key steps to secure a Windows device from malware?,"To secure a Windows device from malware, ensure you have the latest updates installed, enable the firewall, and use antivirus software. Additionally, avoid opening suspicious emails and attachments, and use strong passwords. Regularly back up your data and consider enabling the Windows Defender firewall. Furthermore, use a reputable antivirus program and keep it updated. Consider using a secure browser and enabling the Windows Defender SmartScreen feature.",Malware Protection,Intermediate
How can I protect my organization's sensitive data during a ransomware attack?,"To protect sensitive data during a ransomware attack, have a robust backup system in place, and ensure that backups are stored offline or in an isolated network. Use a reputable antivirus program and enable the firewall on all devices. Consider implementing a data encryption solution, such as BitLocker, and educate employees on how to avoid falling victim to phishing attacks. Regularly update software and operating systems, and consider using a disaster recovery plan to minimize downtime. Monitor system logs and network traffic to detect suspicious activity, and have a clear incident response plan in place.",Incident Response,Advanced
What are the benefits of using a VPN for remote work?,"Using a VPN for remote work provides several benefits, including secure and encrypted internet traffic, protection from public Wi-Fi threats, and access to a secure and private network. A VPN also helps protect against DNS leaks and IP spoofing, and allows employees to securely connect to company resources from anywhere. Consider using a reputable VPN service and ensure it is configured correctly on all devices. Regularly update the VPN software and firmware, and consider implementing two-factor authentication to add an extra layer of security.",Network Security,Intermediate
How do I set up a secure password manager?,"To set up a secure password manager, choose a reputable provider and install the software on all devices. Create a strong master password and consider using a password generator to create unique and complex passwords for each account. Use two-factor authentication and enable biometric login if available. Consider setting up a password policy to enforce strong passwords and regular password rotation. Regularly update the password manager software and consider implementing a password manager for the organization as a whole. Educate employees on the importance of password security and consider implementing a password reset process to minimize downtime.",Authentication,Intermediate
What are the key steps to recover from a data loss incident?,"To recover from a data loss incident, have a clear disaster recovery plan in place, and regularly back up data to an offsite location. Identify the source of the data loss and contain the issue to prevent further damage. Assess the data loss and determine the best course of action, such as restoring from backups or using data recovery software. Consider using a data backup service and ensure that backups are complete and up-to-date. Communicate with stakeholders and document the incident, and consider conducting a post-incident review to identify areas for improvement.",Data Backup and Recovery,Intermediate
What are the best practices for password management in the workplace?,"To ensure strong password security in the workplace, employees should use a combination of uppercase and lowercase letters, numbers, and special characters. They should also avoid using easily guessable information such as names, birthdays, or common words. Passwords should be at least 12 characters long and changed every 60 days. Employers should implement a password policy that requires employees to use a password manager and enable multi-factor authentication (MFA) for all users. This will significantly reduce the risk of password-based attacks and protect sensitive company data.",Incident Response,Intermediate
How do I protect my organization's data from a ransomware attack?,"To protect your organization's data from a ransomware attack, ensure that all systems and software are up-to-date with the latest security patches and updates. Implement a robust backup system that includes both on-site and cloud-based backups. Use a reputable antivirus software and enable real-time threat detection. Educate employees on safe computing practices, such as avoiding suspicious emails and attachments, and using strong passwords. Regularly test your backup system to ensure data can be restored in case of an attack. Consider implementing a disaster recovery plan and have a crisis management team in place to respond quickly and effectively in the event of a ransomware attack.",Data Backup and Recovery,Advanced
What are some common signs of a phishing attack?,"Common signs of a phishing attack include unsolicited emails or messages asking for sensitive information, such as login credentials or financial information. Be cautious of emails with spelling and grammar mistakes, as well as those that create a sense of urgency or panic. Legitimate organizations will never ask for sensitive information via email. Be wary of links or attachments from unknown senders, as they may contain malware or viruses. If you're unsure about the legitimacy of an email, verify the sender's identity and contact them directly using a phone number or email address you know is genuine.",Malware Protection,Basic
How do I secure my organization's IoT devices?,"To secure your organization's IoT devices, ensure that all devices are patched and updated regularly. Use strong, unique passwords for each device and implement MFA to prevent unauthorized access. Use a network access control system to monitor and control device connections. Implement a secure communication protocol, such as HTTPS, to protect data transmitted between devices. Regularly monitor IoT device activity for suspicious behavior and implement a response plan in case of a security incident. Consider implementing a device management system to track and manage IoT devices across your organization.",Network Security,Intermediate
What is the difference between a virus and a worm?,"A virus is a type of malware that requires human interaction to spread, whereas a worm is a type of malware that can spread autonomously without human interaction. Viruses typically attach themselves to existing programs and replicate themselves, while worms can move from system to system without the need for human intervention. Worms are generally more destructive and can cause significant damage to a network or system. Both viruses and worms can be prevented by using antivirus software, keeping software up-to-date, and being cautious when opening emails and attachments from unknown sources.",Malware Protection,Intermediate
How do I respond to a security incident?,"In the event of a security incident, remain calm and follow a structured response plan. Isolate the affected system or network to prevent further damage. Gather information about the incident, including the type of threat, the affected systems, and the impact on the organization. Notify relevant stakeholders, including IT, management, and regulatory bodies. Contain the incident by disabling or isolating the affected systems. Eradicate the threat by removing malware or patching vulnerabilities. Recover the affected systems and data, and implement measures to prevent similar incidents in the future.",Incident Response,Advanced
What is the difference between a firewall and an antivirus?,"A firewall monitors incoming and outgoing network traffic and blocks malicious activity, while an antivirus software scans your device for malware and other types of viruses. Both are essential for protecting your computer from cyber threats. For optimal protection, use both together.",Network Security,Intermediate
How do I create a strong password?,"A strong password should be at least 12 characters long, include a mix of uppercase and lowercase letters, numbers, and special characters. Avoid using easily guessable information such as your name, birthdate, or common words. Consider using a passphrase for added security.",Authentication,Basic
What is a phishing attack and how can I prevent it?,"A phishing attack is when a hacker sends a fake email or message that appears to be from a legitimate source, trying to trick you into revealing sensitive information. To prevent phishing, be cautious with links and attachments, verify the sender's identity, and never provide personal info unless you initiated the contact. Use a reputable antivirus software to block malicious emails.",Incident Response,Intermediate
How do I back up my important files?,"To back up your files, use an external hard drive or cloud storage service like Google Drive or Dropbox. Set up automatic backups to ensure your files are saved regularly. Consider using a backup software that includes incremental backups for added security. Always verify that your backups are complete and restorable in case of data loss.",Data Backup and Recovery,Intermediate
What is the importance of keeping software up to date?,"Keeping software up to date is crucial for patching security vulnerabilities and protecting against known exploits. Regular updates often include bug fixes, performance improvements, and security patches. Neglecting to update software can leave your device open to attacks. Enable automatic updates or regularly check for updates to ensure you have the latest security features.",Malware Protection,Basic
How do I secure my mobile device?,"To secure your mobile device, enable a screen lock, use a secure lock screen password or biometric authentication, keep your operating system and apps updated, and use a reputable antivirus software. Be cautious when downloading apps, and avoid using public Wi-Fi for sensitive activities. Regularly back up your data to a secure location.",Mobile Security,Intermediate
What is the primary purpose of a firewall in network security?,"A firewall is a network security system that monitors and controls incoming and outgoing network traffic based on predetermined security rules. It acts as a barrier between a trusted network and an untrusted network, such as the internet, to prevent unauthorized access and malicious activity. Firewalls can be hardware or software-based and are often configured to block specific types of traffic or block traffic from specific IP addresses or domains.",Network Security,Intermediate
How do I update my antivirus software to ensure it stays effective against new malware threats?,"To update your antivirus software, go to the software's settings or preferences menu and click on the 'Update' or 'Check for Updates' option. This will automatically check for any new virus definitions and updates. You may also be prompted to restart your computer or update the software manually. It's essential to keep your antivirus software up-to-date to protect against new and emerging threats. You can also enable automatic updates to ensure your software stays current without manual intervention.",Malware Protection,Basic
What is the difference between a brute-force attack and a phishing attack?,"A brute-force attack involves attempting to guess a password or PIN by trying a large number of combinations in a short amount of time. This type of attack can be prevented by enabling multi-factor authentication, using strong passwords, and limiting login attempts. On the other hand, a phishing attack involves tricking a user into revealing sensitive information, such as login credentials or financial information, through a fake email or website. This type of attack can be prevented by being cautious when clicking on links or providing personal information online and by using strong antivirus software.",Incident Response,Intermediate
What is the importance of regular data backups in cybersecurity?,"Regular data backups are crucial in cybersecurity as they ensure that critical data is safe in case of a ransomware attack or hardware failure. Backups should be stored offline or in a secure location, such as a cloud storage service, to prevent unauthorized access. It's also essential to test backups regularly to ensure they can be restored in case of a disaster. By having regular backups, you can minimize downtime and data loss, and quickly recover in case of a security incident.",Data Backup and Recovery,Basic
What are the benefits of using a password manager for mobile devices?,"Using a password manager for mobile devices provides several benefits, including generating and storing unique, complex passwords, autofilling login credentials, and alerting you to potential security threats. Password managers also allow you to share secure passwords with trusted contacts and provide an added layer of security by using encryption and two-factor authentication. By using a password manager, you can significantly improve your mobile device's security and reduce the risk of password-related breaches.",Mobile Security,Intermediate
How do I protect my company's data from ransomware?,"To protect your company's data from ransomware, implement regular backups, keep software up to date, and use robust antivirus software. Educate employees on phishing attacks and ensure they use strong passwords. Consider investing in a disaster recovery plan to minimize downtime in case of a ransomware attack.",Data Backup and Recovery,Intermediate
What is the difference between a firewall and a VPN?,"A firewall is a network security system that monitors and controls incoming and outgoing network traffic based on predetermined security rules. A VPN (Virtual Private Network) is a secure tunnel that encrypts internet traffic between your device and a VPN server, providing a secure and private connection. A firewall is a fundamental component of network security, while a VPN provides an additional layer of security when accessing public Wi-Fi or untrusted networks.",Network Security,Intermediate
