Question,Answer,Category,Difficulty
How do I protect my company's network from ransomware attacks?,"To protect your company's network from ransomware, implement a robust security posture by enforcing least privilege access, regularly update software and firmware, and use a reputable antivirus solution. Regularly back up data and test backups to ensure they can be restored in case of an attack. Implement a security information and event management (SIEM) system to monitor and analyze system logs, and have an incident response plan in place to quickly respond to potential threats. Finally, educate employees on safe browsing habits and the importance of phishing prevention.",Network Security,Intermediate
What are the best practices for creating a strong password?,"A strong password should be at least 12 characters long, a mix of uppercase and lowercase letters, numbers, and special characters. Avoid using easily guessable information like names, birthdays, or common words. Use a password manager to securely store and generate complex passwords, and change them every 60-90 days. Consider using a passphrase, which is a sequence of words that is easy to remember but difficult for others to guess. Finally, enable two-factor authentication (2FA) to add an extra layer of security.",Authentication,Basic
How do I recover my data after a ransomware attack?,"In the event of a ransomware attack, disconnect your computer from the internet to prevent the malware from spreading. Immediately contact your IT department or a security expert for assistance. Restore data from backups, which should be stored securely and frequently updated. If backups are unavailable, try to recover data using data recovery software or services. Report the incident to the relevant authorities and take steps to prevent future attacks, such as implementing a robust security posture, educating employees, and conducting regular security audits.",Data Backup and Recovery,Intermediate
What are the benefits of using a VPN when working remotely?,"Using a virtual private network (VPN) when working remotely provides several benefits, including secure internet access, protection against public Wi-Fi threats, and encryption of data transmission. A VPN creates a secure tunnel between your device and the VPN server, shielding your online activities from hackers and cyber threats. Additionally, a VPN can help mask your IP address, making it difficult for malicious actors to track your online activities. When choosing a VPN, select a reputable provider that uses strong encryption protocols and has a no-logs policy to ensure your data remains secure.",Network Security,Intermediate
How do I prevent social engineering attacks?,"To prevent social engineering attacks, educate employees on the tactics used by attackers, such as phishing, pretexting, and baiting. Implement security awareness training programs to recognize and report suspicious emails or messages. Use security software that can detect and block phishing attempts. Use strong passwords and multi-factor authentication to secure accounts. Limit access to sensitive information and ensure that employees only receive necessary information on a need-to-know basis. Finally, regularly review and update security policies to stay ahead of evolving threats.",Incident Response,Intermediate
What is the difference between a virus and a worm?,"A virus is a type of malware that requires human interaction to spread, whereas a worm is a type of malware that can spread automatically without human interaction. Viruses typically attach themselves to files or programs and replicate when a user opens the infected file. Worms, on the other hand, can spread through networks and exploit vulnerabilities to infect other systems. Both viruses and worms can cause significant harm to systems and data, so it's essential to have robust antivirus software and a robust security posture to prevent and detect these types of threats.",Malware Protection,Basic
How do I protect my company's data from a ransomware attack?,"To protect your company's data from a ransomware attack, implement a robust backup and recovery strategy, including regular backups of critical data, use of encryption, and a disaster recovery plan. Ensure all employees are trained on security best practices and use antivirus software that includes anti-ransomware capabilities. Regularly update your operating system, software, and plugins to prevent vulnerabilities. Additionally, use a reputable security solution that includes endpoint detection and response (EDR) and implement a security information and event management (SIEM) system to monitor for suspicious activity. Consider using a cloud-based backup solution to ensure business continuity in case of a ransomware attack. Keep all software up to date and install security patches promptly, and use a secure network with strong passwords and multi-factor authentication. Use a reputable security information and event management (SIEM) system to monitor for suspicious activity and have a comprehensive incident response plan in place. Finally, educate employees on how to identify and report potential ransomware threats, such as suspicious emails or attachments, to prevent initial compromise. It is also crucial to have a plan in place for a potential attack, including communication strategies, recovery procedures, and business continuity plans. This will help ensure the protection of your company's data and minimize the impact of a ransomware attack.",Incident Response,Advanced
What is the best way to protect against phishing attacks?,"To protect against phishing attacks, employees should be cautious when clicking on links or opening attachments from unknown senders. Be aware of common phishing tactics, such as urgent or threatening messages, and verify the authenticity of emails by checking the sender's email address and looking for spelling and grammar mistakes. Use strong antivirus software and enable two-factor authentication to add an extra layer of security. Educate employees on the risks of phishing and provide regular training to help them identify and avoid potential threats.",Incident Response,Intermediate
How do I update my operating system for the latest security patches?,"To update your operating system, go to the settings or control panel, select the 'Update & Security' or 'Software Update' option, and follow the prompts to download and install the latest updates. You can also enable automatic updates to ensure your system stays secure. Make sure to restart your computer after the update to ensure all changes take effect. Consider using a third-party update tool if you're unable to update through the official channel.",Network Security,Basic
What are the key differences between a firewall and antivirus software?,"A firewall acts as a barrier between your computer and the internet, blocking unauthorized access to your system. It monitors incoming and outgoing network traffic and blocks suspicious activity. Antivirus software, on the other hand, scans your system for malware and removes any threats it finds. Firewalls and antivirus software work together to provide comprehensive protection against cyber threats. Firewalls are typically provided by the operating system, while antivirus software is a separate application that needs to be installed.",Network Security,Intermediate
How do I create a secure password for my online accounts?,"To create a secure password, use a combination of uppercase and lowercase letters, numbers, and special characters. Avoid using easily guessable information such as your name, birthdate, or common words. Use a password manager to generate and store unique, complex passwords for each account. Change your passwords regularly and avoid using the same password for multiple accounts. Consider using a passphrase, a sequence of words, to make your password more memorable.",Authentication,Basic
What is the purpose of a VPN and how does it work?,"A Virtual Private Network (VPN) creates a secure, encrypted connection between your device and a VPN server, protecting your internet traffic from interception and eavesdropping. When you connect to a VPN, your data is routed through the VPN server, which masks your IP address and location. This makes it difficult for hackers to track your online activity and access your personal data. VPNs are commonly used for remote work, public Wi-Fi security, and accessing geo-restricted content.",Network Security,Intermediate
How do I backup my important files and data?,"To backup your files, use an external hard drive, cloud storage, or both. Set up automatic backups to ensure your files are updated regularly. Consider using a backup software that allows you to schedule backups and monitor their status. Store your backups in a secure location, such as a safe or a fireproof safe, and test your backups regularly to ensure they're complete and recoverable. Use a backup solution that supports versioning to track changes and recover previous versions if needed.",Data Backup and Recovery,Intermediate
What is the difference between a keylogger and a Trojan horse?,"A keylogger is a type of malware that records your keystrokes, often to steal sensitive information such as login credentials. A Trojan horse, on the other hand, is a type of malware that disguises itself as a legitimate program or file, but actually contains malicious code that can harm your system. Keyloggers typically require user interaction, such as installing a malicious software, while Trojan horses can spread through phishing emails or infected software downloads. Both types of malware can be used to steal sensitive information or take control of your system.",Malware Protection,Intermediate
How do I protect my mobile device from malware?,"To protect your mobile device from malware, use a reputable antivirus app, keep your operating system and apps up to date, and be cautious when downloading apps from unknown sources. Use strong passwords and enable two-factor authentication to prevent unauthorized access. Be aware of phishing scams and avoid clicking on suspicious links or opening attachments from unknown senders. Regularly review your app permissions and remove any unnecessary apps to minimize potential vulnerabilities.",Mobile Security,Basic
What is the importance of regularly updating software and operating systems?,"Regularly updating software and operating systems is crucial to ensure you have the latest security patches and features. Updates often fix vulnerabilities that can be exploited by hackers, protecting your system from malware and cyber threats. Outdated software can leave you exposed to known security risks, making it easier for attackers to breach your system. Keep your software and operating system up to date to maintain a secure environment and prevent potential security breaches.",Network Security,Intermediate
How do I secure my home router?,"To secure your home router, change the default admin password, enable WPA3 encryption, and update the firmware regularly. Use a strong password and enable WPS to prevent unauthorized access. Set up a guest network for visitors and disable any unnecessary features, such as WPS, to reduce potential vulnerabilities. Use a reputable router with built-in security features and consider setting up a VPN to encrypt your internet traffic.",Network Security,Intermediate
What is the purpose of a security information and event management (SIEM) system?,"A Security Information and Event Management (SIEM) system is a comprehensive security solution that monitors and analyzes security-related data from various sources, such as network devices, servers, and applications. SIEM systems provide real-time threat detection, incident response, and compliance reporting, helping organizations identify and respond to security incidents more effectively. They also provide a centralized view of security data, enabling security teams to make informed decisions and improve their security posture.",Incident Response,Advanced
What are the benefits of using a password manager?,"A password manager is a secure application that safely stores and generates strong, unique passwords for all your online accounts. It helps you avoid using the same password across multiple sites and prevents password-related security breaches. Use a reputable password manager to secure your sensitive information and protect against cyber threats.",Authentication,Basic
How do I prevent malware from infecting my computer?,"To prevent malware from infecting your computer, keep your operating system and software up-to-date, use reputable antivirus software, and avoid opening suspicious emails or attachments. Be cautious when clicking on links or downloading files from unknown sources. Regularly back up your data to prevent loss in case of a malware attack.",Malware Protection,Intermediate
What is the purpose of a firewall in network security?,"A firewall is a network security system that monitors and controls incoming and outgoing network traffic based on predetermined security rules. Its primary purpose is to block unauthorized access to or from a private network while allowing authorized communication. Firewalls help prevent cyber attacks, such as hacking and malware, from reaching your device or network.",Network Security,Intermediate
What are the key steps in responding to a ransomware attack?,"In the event of a ransomware attack, disconnect the infected device from the network to prevent the malware from spreading. Preserve any evidence of the attack, including logs and backups. Then, contact your organization's incident response team or a cybersecurity expert for guidance. They will work to contain the attack, recover data, and implement measures to prevent future attacks.",Incident Response,Advanced
Why is data backup and recovery important for cybersecurity?,"Data backup and recovery are crucial for cybersecurity as they ensure business continuity in the event of a data loss or system failure. Regular backups provide a safeguard against data corruption, deletion, or loss due to malware or other security breaches. A reliable backup and recovery strategy also helps meet regulatory requirements and protects against financial losses.",Data Backup and Recovery,Basic
What are the key features of a secure mobile device?,A secure mobile device should have a lock screen with a strong password or biometric authentication. Enable device encryption to protect data at rest and in transit. Regularly update the operating system and apps to ensure you have the latest security patches. Use a reputable antivirus app and be cautious when downloading and installing apps from unknown sources.,Mobile Security,Intermediate
What are the best practices for password management in the workplace?,"Password management is an essential aspect of cybersecurity. To ensure strong passwords, implement a password policy that requires employees to change their passwords every 60-90 days. Use a password manager to store and generate complex passwords. Enforce password requirements such as a mix of uppercase and lowercase letters, numbers, and special characters. Educate employees on social engineering tactics and phishing attacks to prevent password compromise. Consider implementing multi-factor authentication (MFA) to add an extra layer of security. Monitor for suspicious login attempts and take swift action to contain any potential breaches.",Authentication,Intermediate
What is the difference between a firewall and an antivirus program?,"A firewall is a network security system that monitors and controls incoming and outgoing network traffic based on predetermined security rules. An antivirus program, on the other hand, is a software that detects and removes malware, such as viruses, Trojans, and spyware, from a computer. While both are essential for cybersecurity, they serve different purposes and are not interchangeable.",Network Security,Intermediate
How do I protect my organization from ransomware attacks?,"To protect your organization from ransomware attacks, ensure all software is up-to-date, use strong antivirus software, back up data regularly, and educate employees on safe browsing practices. Implement a robust backup and disaster recovery plan, and consider implementing a security information and event management (SIEM) system to monitor for suspicious activity. Regularly test backups to ensure they are recoverable in case of an attack.",Data Backup and Recovery,Advanced
What are the best practices for creating a strong password?,"A strong password should be at least 12 characters long, include a mix of uppercase and lowercase letters, numbers, and special characters, and avoid easily guessable information such as names or birthdays. Change your password regularly, ideally every 60 to 90 days, and use a password manager to securely store and generate unique, complex passwords for each account.",Authentication,Basic
How do I secure my mobile device from malware?,"To secure your mobile device from malware, keep the operating system and apps up-to-date, use a reputable antivirus app, and only download apps from trusted sources such as the official app store. Be cautious of phishing scams and avoid clicking on suspicious links or downloading attachments from unknown sources. Enable a screen lock or biometric authentication, and regularly back up your data to a secure location.",Mobile Security,Intermediate
What is the importance of incident response planning?,"Incident response planning is crucial for organizations to quickly respond to and contain cyber threats. It involves identifying potential threats, developing procedures for incident response, and training employees on how to respond in case of an incident. A well-planned incident response plan helps minimize the impact of a cyber attack, reduces downtime, and protects sensitive data.",Incident Response,Intermediate
How do I prevent phishing attacks?,"To prevent phishing attacks, be cautious of emails with suspicious links or attachments, verify the sender's identity, and avoid responding to unsolicited emails. Use strong passwords, enable two-factor authentication, and use a reputable antivirus program. Regularly update your operating system and software, and use a secure search engine to avoid visiting malicious websites. Educate employees on phishing tactics and conduct regular training sessions to raise awareness about phishing attacks.",Malware Protection,Advanced
What is the difference between a firewall and an antivirus program?,"A firewall monitors incoming and outgoing network traffic based on predetermined security rules to block unauthorized access, whereas an antivirus program detects and removes malware from a device. In contrast, a firewall focuses on network security, while an antivirus program focuses on protecting the device itself.",Network Security,Basic
How do I create a strong password?,"A strong password should be at least 12 characters long, include a mix of uppercase and lowercase letters, numbers, and special characters, and avoid using easily guessable information such as your name or birthdate. Consider using a passphrase instead of a single word, and update it regularly to maintain maximum security.",Authentication,Intermediate
What are some common types of malware?,"Malware includes viruses, worms, trojans, ransomware, spyware, adware, and rootkits. Viruses replicate and spread to other devices, worms self-replicate and spread without user interaction, trojans disguise themselves as legitimate software, and ransomware encrypts files and demands payment for decryption. Spyware and adware track user activity for malicious purposes, and rootkits hide malware from the operating system and security software.",Malware Protection,Advanced
How often should I update my operating system and software?,"Regularly update your operating system, browser, and other software to ensure you have the latest security patches and features. Enable automatic updates whenever possible, and manually update any software that doesn't support automatic updates. This helps protect against known vulnerabilities and prevents exploitation by attackers.",Data Backup and Recovery,Intermediate
What is the difference between a phishing email and a spear phishing email?,"A phishing email is a general, mass-sent email that attempts to trick users into revealing sensitive information. A spear phishing email is a targeted email that is tailored to a specific individual or organization, often using social engineering tactics to trick the recipient into revealing sensitive information. Spear phishing emails are more sophisticated and effective than phishing emails.",Incident Response,Advanced
How do I securely back up my data?,"Use a combination of local and cloud backups to ensure data redundancy and availability. Choose a reputable backup software that encrypts data in transit and at rest. Schedule regular backups, and consider using a backup schedule that includes incremental backups to minimize data loss in case of a disaster. Always test your backups to ensure they are restorable and complete.",Data Backup and Recovery,Intermediate
What is the importance of two-factor authentication in mobile security?,"Two-factor authentication (2FA) adds an additional layer of security to the login process by requiring a second form of verification, such as a code sent to your phone or a fingerprint scan. This makes it much harder for attackers to gain unauthorized access to your account, even if they have your password. 2FA is particularly important for mobile devices, as they are often used for sensitive transactions and activities.",Mobile Security,Basic
What are the key differences between WPA2 and WPA3 encryption?,"WPA3 is an improvement over WPA2, offering better protection against password guessing and man-in-the-middle attacks. It also includes features such as individualized data encryption and authentication, making it more secure than WPA2. WPA3 is the current standard, replacing WPA2, which is being phased out due to its vulnerabilities. To secure your home network, it's essential to switch to WPA3 encryption.",Network Security,Intermediate
How do I properly dispose of old devices containing sensitive data?,"When disposing of old devices, such as computers, phones, or hard drives, it's crucial to ensure that sensitive data is completely erased. Use a secure erase method, such as a DOD-approved wipe or a reputable third-party tool, to overwrite the data multiple times. If the device is physically damaged, consider using a data destruction service. Additionally, recycle the device responsibly, and ensure you have wiped any connected storage devices, like USB drives or SD cards.",Data Backup and Recovery,Intermediate
What are the key steps to take when responding to a ransomware attack?,"In the event of a ransomware attack, isolate the infected system to prevent further spread, then disconnect it from the network and power it down. Gather information about the attack, including the type of ransomware and the extent of the damage. Contact your IT department or a cybersecurity expert for assistance. Never pay the ransom, as this does not guarantee data recovery and may encourage further attacks. Instead, focus on restoring data from backups and implementing measures to prevent future attacks, such as regular backups, secure software updates, and employee education.",Incident Response,Advanced
What are some best practices for creating strong passwords?,"To create strong passwords, use a combination of uppercase and lowercase letters, numbers, and special characters. Avoid using easily guessable information like your name or birthdate. Use a password manager to generate and store unique, complex passwords for each account. Consider using a passphrase, which is a sequence of words that is easier to remember but still secure. Change your passwords regularly, ideally every 60 to 90 days, and enable two-factor authentication (2FA) whenever possible.",Authentication,Basic
How do I prevent malware from spreading to other devices on my network?,"To prevent malware from spreading, ensure all devices on your network are up to date with the latest security patches and software updates. Implement a firewall to block suspicious traffic, and use an antivirus program to detect and remove malware. Regularly scan your network for vulnerabilities and patch any issues promptly. Use a network segmentation strategy to isolate sensitive areas of your network and limit the spread of malware. Educate employees on safe computing practices, such as not opening suspicious emails or attachments.",Malware Protection,Intermediate
What is the importance of data backup and recovery in cybersecurity?,"Data backup and recovery are crucial components of a comprehensive cybersecurity strategy. Regular backups ensure that data is safe in case of a disaster or ransomware attack. A good backup plan includes storing data in multiple locations, both on-site and off-site, and testing the backups regularly to ensure they are complete and accessible. In the event of a data loss, a well-executed recovery plan can minimize downtime and financial losses. It's essential to have a clear data backup and recovery plan in place to protect your organization's data and reputation.",Data Backup and Recovery,Intermediate
