Question,Answer,Category,Difficulty
What are the key steps to set up a secure backup system for my business data?,"To set up a secure backup system, identify the data to be backed up, choose a reliable backup method (cloud or local), automate the backup process, store backups offsite, test the backups regularly, and use encryption for secure data transmission. This will ensure business continuity in case of data loss or disaster.",Data Backup and Recovery,Intermediate
How can I protect my mobile device from phishing attacks?,"To protect your mobile device from phishing attacks, be cautious of suspicious emails and messages, verify sender identities, avoid clicking on links from unknown sources, use strong passwords, and enable two-factor authentication. Regularly update your device's operating system and apps, and use a reputable antivirus app to detect and remove malware.",Mobile Security,Basic
What is the difference between a firewall and a VPN?,"A firewall is a network security system that monitors and controls incoming and outgoing network traffic based on predetermined security rules. A VPN, or Virtual Private Network, creates a secure and encrypted connection between your device and a VPN server, masking your IP address and protecting your data. Both firewalls and VPNs are essential for protecting your network and data, but they serve different purposes. Firewalls are more focused on blocking malicious traffic, while VPNs are more focused on encrypting your data and protecting your identity.",Network Security,Intermediate
How do I protect my organization's sensitive data in the event of a ransomware attack?,"In the event of a ransomware attack, it's crucial to have a robust backup and disaster recovery plan in place. This includes regular backups of critical data, both on-site and off-site, and a plan for restoring data from backups in case of a disaster. Additionally, consider implementing a ransomware-specific incident response plan, which includes isolating affected systems, disconnecting from the internet, and contacting law enforcement. It's also essential to keep software up-to-date, use strong antivirus software, and train employees on cybersecurity best practices to prevent initial infections.",Incident Response,Advanced
What is the importance of password rotation and how often should it be done?,"Password rotation is the process of regularly changing your passwords to maintain the security of your accounts. It's essential to rotate passwords every 60 to 90 days to prevent password cracking and unauthorized access. This is especially important for sensitive accounts, such as those used for accessing critical systems or sensitive data. When rotating passwords, make sure to create unique and complex passwords for each account, and avoid using the same password for multiple accounts. Consider using a password manager to generate and store complex passwords, making it easier to manage and rotate them regularly.",Authentication,Basic
How can I ensure the security of my company's mobile devices?,"To ensure the security of your company's mobile devices, implement a mobile device management (MDM) solution that allows you to remotely manage and monitor devices. This includes enforcing strong passwords, encrypting data, and installing security software. Regularly update your devices to the latest operating system and app versions, and consider implementing a zero-trust network access (ZTNA) solution to ensure that devices can only access the resources they need. Additionally, educate employees on mobile security best practices, such as using two-factor authentication and avoiding public Wi-Fi for sensitive activities.",Mobile Security,Intermediate
What are the best practices for data backup and recovery?,"Data backup and recovery is crucial for ensuring business continuity in case of a disaster. The best practices include creating multiple backups of critical data, both on-site and off-site, and using a backup solution that supports versioning and incremental backups. Regularly test backups to ensure they are complete and restorable, and consider implementing a disaster recovery plan that includes a recovery time objective (RTO) and a recovery point objective (RPO). Use the 3-2-1 rule: three copies of data, two different types of storage, and one off-site copy. This will ensure that you have a robust backup and recovery strategy in place.",Data Backup and Recovery,Advanced
How can I prevent malware from infecting my home network?,"To prevent malware from infecting your home network, keep your operating system, software, and apps up-to-date with the latest security patches. Use strong antivirus software and a firewall to block malicious traffic. Be cautious when opening email attachments or clicking on links from unknown sources, and avoid using public Wi-Fi for sensitive activities. Regularly scan your devices for malware and viruses, and use a reputable anti-malware solution to detect and remove threats. Consider implementing a home network security solution that includes a router with built-in security features, such as intrusion detection and prevention.",Malware Protection,Intermediate
What are the best practices for password management in a team environment?,"To manage passwords securely in a team environment, use a password manager like LastPass or 1Password. Ensure all team members have unique, strong passwords, and store them in the password manager. Consider implementing a password rotation policy and enforcing multi-factor authentication. This approach helps prevent password reuse and unauthorized access to sensitive information. Ensure to rotate passwords regularly and enforce password policies to minimize the risk of a data breach. Consider implementing a single sign-on (SSO) solution to simplify the login process for users and improve security. This will help ensure the team maintains strong password hygiene and protects the organization from potential security threats.",Authentication,Intermediate
How can I prevent malware infections on my company's network?,"To prevent malware infections on your company's network, implement a robust security strategy that includes regular software updates, patching, and a robust antivirus solution. Use a firewall to block unauthorized access and limit employee privileges. Educate employees on the risks of malware and phishing, and implement a zero-trust policy to prevent lateral movement. Consider implementing a sandbox environment to test new software and applications before deploying them to the production network. Regularly back up your data and maintain an incident response plan to minimize the impact of a potential malware attack. This will help prevent malware infections and protect your company's sensitive data. ",Malware Protection,Advanced
What is the best way to secure my company's IoT devices?,"To secure your company's IoT devices, implement a robust security framework that includes network segmentation, secure configuration, and regular software updates. Use strong passwords and limit network access to IoT devices. Use a secure communication protocol like HTTPS or SFTP for data transfer. Implement a network access control (NAC) system to monitor and control device connections. Regularly scan for vulnerabilities and patch them promptly to prevent exploitation. This will help prevent unauthorized access and protect your company's IoT devices from cyber threats. Consider implementing a secure by design approach to ensure IoT devices are secure from the start. This will help protect your company's network from IoT-related security risks.",Network Security,Intermediate
What are the key steps to follow during a cybersecurity incident response?,"When responding to a cybersecurity incident, follow a structured approach to minimize damage and ensure a swift recovery. The first step is to contain the incident by isolating affected systems and networks. Next, assess the incident to identify the root cause and determine the scope of the breach. Develop a plan to remediate the incident, including erasing affected data, restoring systems, and patching vulnerabilities. Communicate the incident to stakeholders, including employees, customers, and regulatory bodies. Finally, review the incident to identify areas for improvement and implement changes to prevent future incidents. This will help ensure a swift and effective incident response, minimizing the impact of the breach on your company. Consider implementing a incident response plan to guide the response efforts. This will help you respond to incidents efficiently and protect your company's reputation.",Incident Response,Advanced
What is the best way to back up my company's data?,"To back up your company's data, implement a robust backup strategy that includes a combination of local and cloud backups. Use a reputable backup software that supports versioning and incremental backups. Regularly test your backups to ensure they are complete and restorable. Consider implementing a backup and recovery solution that supports automated backups, encryption, and compression. Ensure to back up critical data regularly, including user data, configuration files, and system state. This will help ensure business continuity and minimize downtime in the event of a data loss or system failure. Consider implementing a disaster recovery plan to guide the recovery efforts. This will help you recover from a disaster and minimize the impact on your business.",Data Backup and Recovery,Intermediate
How can I secure my company's mobile devices?,"To secure your company's mobile devices, implement a mobile device management (MDM) solution that includes device enrollment, security policies, and app management. Use strong passwords and enable encryption for all mobile devices. Implement a secure boot process and ensure devices are running the latest operating system and security patches. Use a secure communication protocol like HTTPS or SFTP for data transfer. Regularly scan for vulnerabilities and patch them promptly to prevent exploitation. Consider implementing a zero-trust policy to limit access to sensitive data. This will help prevent unauthorized access and protect your company's mobile devices from cyber threats.",Mobile Security,Intermediate
What is the difference between a firewall and an antivirus program?,"A firewall monitors incoming and outgoing network traffic, blocking unauthorized access and malicious activity, whereas an antivirus program scans for and removes malware from your device. Both are crucial for protecting your system from cyber threats. For example, a firewall can block a hacker from accessing your device, while an antivirus can detect and eliminate a virus that's already present.",Network Security,Intermediate
How do I reset a forgotten password for my Windows account?,"To reset a forgotten password, go to the login screen, click on the 'I forgot my password' option, and enter the username. Choose a password reset method, such as answering security questions or receiving a code via email. Follow the prompts to create a new password, and ensure it's strong and unique to prevent future password reset issues.",Authentication,Basic
What are some common types of malware and how can I protect against them?,"Common types of malware include viruses, Trojans, spyware, and ransomware. To protect against them, keep your operating system and software up-to-date, use an antivirus program, avoid suspicious downloads and attachments, and be cautious when clicking on links or opening email attachments from unknown senders. Regularly back up your data to prevent data loss in case of a malware attack.",Malware Protection,Intermediate
How do I create a strong password for my online accounts?,"To create a strong password, use a combination of uppercase and lowercase letters, numbers, and special characters. Avoid using easily guessable information like your name or birthdate. Use a password manager to generate and store unique, complex passwords for each account. Change your passwords regularly and avoid reusing them across multiple platforms to minimize the risk of a data breach.",Authentication,Intermediate
What should I do in case of a ransomware attack?,"In case of a ransomware attack, disconnect from the internet immediately to prevent the malware from spreading. Do not pay the ransom, as it does not guarantee your data will be recovered. Instead, use backups to restore your data, and report the incident to your IT department or law enforcement. Update your antivirus software and run a full scan to ensure the malware is removed.",Incident Response,Advanced
How do I secure my mobile device against cyber threats?,"To secure your mobile device, enable a lock screen, use a password or PIN, and install an antivirus app. Regularly update your operating system and apps, and avoid installing suspicious apps. Use a VPN when connecting to public Wi-Fi, and be cautious when clicking on links or opening attachments from unknown sources. Enable two-factor authentication to add an extra layer of security.",Mobile Security,Intermediate
What is a backup and how often should I create one?,"A backup is a copy of your data that can be used to restore your system in case of a disaster or data loss. Create a backup regularly, ideally daily or weekly, depending on how often your data changes. Store backups in a secure location, such as an external hard drive or cloud storage, and test the backups periodically to ensure they are complete and recoverable.",Data Backup and Recovery,Intermediate
What is the difference between a firewall and an antivirus program?,"A firewall is a network security system that monitors and controls incoming and outgoing network traffic based on predetermined security rules, while an antivirus program is designed to detect, remove, and prevent malware from infecting a computer. Firewalls can be software or hardware-based, while antivirus programs are software-based. Both are essential components of a robust cybersecurity defense.",Network Security,Intermediate
How do I protect my organization from phishing attacks?,"To protect your organization from phishing attacks, educate employees about the dangers of phishing emails and provide them with regular training on how to identify and report suspicious emails. Implement a robust email security solution that includes features like sandboxing, URL filtering, and attachment scanning. Use two-factor authentication (2FA) to add an extra layer of security to your email accounts. Regularly update and patch your email servers to prevent exploitation of known vulnerabilities.",Incident Response,Advanced
What is the importance of regularly updating software and operating system patches?,"Regularly updating software and operating system patches is crucial to stay protected against known vulnerabilities and zero-day exploits. Patches fix security bugs and weaknesses that could be exploited by attackers, reducing the risk of successful cyberattacks. Failing to apply updates can leave your system vulnerable to exploitation, which can lead to data breaches, malware infections, and other security issues. Make it a habit to regularly check for and install updates to ensure your system remains secure and up-to-date.",Malware Protection,Basic
How do I securely back up my data?,"To securely back up your data, use a reputable backup solution that encrypts data both in transit and at rest. Choose a cloud backup service that has robust security features, such as two-factor authentication, access controls, and versioning. Regularly back up your data to an external hard drive or cloud storage service, and store it in a secure location, such as a safe or a secure data center. Consider using a backup solution that includes disaster recovery capabilities to ensure business continuity in case of a disaster or data loss.",Data Backup and Recovery,Intermediate
What are some best practices for creating strong passwords?,"To create strong passwords, use a combination of uppercase and lowercase letters, numbers, and special characters. Avoid using easily guessable information such as your name, birthdate, or common words. Use a password manager to generate and store unique, complex passwords for each account. Change your passwords regularly, ideally every 60 to 90 days, and avoid using the same password across multiple accounts. Consider implementing a password policy that requires a minimum password length and complexity.",Authentication,Basic
How do I secure my mobile device?,"To secure your mobile device, enable a lock screen with a strong password or PIN. Install a reputable antivirus app and keep it updated. Use a VPN when connecting to public Wi-Fi networks. Enable two-factor authentication (2FA) on your mobile device and on any accounts that support it. Regularly update your device's operating system and apps to ensure you have the latest security patches. Be cautious when downloading and installing apps from unknown sources, and only install apps from trusted app stores.",Mobile Security,Intermediate
What are the steps to follow when responding to a ransomware attack?,"When responding to a ransomware attack, isolate the affected system, disconnect it from the network to prevent further spread. Restore from backups or use backups to recreate the system if necessary. Change all passwords and update software. Notify law enforcement and the affected parties. Use a reputable anti-malware tool to scan for any remaining threats. Document the incident for future reference.",Incident Response,Advanced
How do I create a strong password?,"A strong password should be at least 12 characters long, include a mix of uppercase and lowercase letters, numbers, and special characters. Use a passphrase instead of a single word for better security. Avoid using easily guessable information such as your name, birthdate, or common words. Consider using a password manager to generate and store unique, complex passwords for each account.",Authentication,Intermediate
What are the key differences between WPA2 and WPA3 encryption?,"WPA3 is the latest security protocol for Wi-Fi networks, providing improved protection against brute-force attacks and dictionary attacks. WPA3 uses a 192-bit encryption key compared to WPA2's 128-bit key. WPA3 also includes a feature called 'Dragonfly Key Exchange' to prevent hackers from intercepting your encryption keys. WPA3 is more secure than WPA2, making it the recommended choice for secure networks.",Network Security,Intermediate
How often should I back up my data?,"It's essential to back up your data regularly to prevent data loss in case of a system failure or ransomware attack. Back up your data daily or at least weekly, depending on how frequently your data changes. Store backups in a secure location, such as an external hard drive or cloud storage, and test them periodically to ensure they're recoverable.",Data Backup and Recovery,Basic
What are the common types of mobile malware?,"Mobile malware can be categorized into several types, including trojans, ransomware, spyware, adware, and rootkits. Trojans are malicious programs disguised as legitimate apps. Ransomware encrypts your data and demands a ransom for decryption. Spyware collects your personal data without your consent. Adware displays unwanted ads on your device. Rootkits hide malware or malicious code from your operating system.",Mobile Security,Intermediate
What are the key differences between WPA2 and WPA3 encryption?,"WPA3 encryption is a more secure version of WPA2, offering advanced security features such as individualized data encryption and denial-of-service (DoS) resistance. It also provides more secure password authentication and stronger protection against brute-force attacks. WPA3 encryption is the recommended choice for new Wi-Fi networks, as it provides enhanced security and protection against various types of cyber threats.",Network Security,Intermediate
How do I recover my account if I've forgotten my password?,"If you've forgotten your password, go to the login page and click on the 'Forgot Password' option. Enter your email address or username, and you'll receive an email with a password reset link. Click on the link, and follow the prompts to create a new password. Make sure to choose a strong and unique password and avoid using the same password for multiple accounts.",Authentication,Basic
What is the difference between a vulnerability and an exploit?,A vulnerability is a weakness or flaw in a system or application that can be exploited by an attacker to gain unauthorized access or cause harm. An exploit is a malicious code or technique used to take advantage of a vulnerability and gain unauthorized access or control over a system or data. Understanding the difference between vulnerabilities and exploits is crucial for identifying and mitigating potential security threats.,Incident Response,Intermediate
How often should I update my antivirus software?,"It's essential to update your antivirus software regularly to ensure you have the latest virus definitions and protection against emerging threats. Check for updates at least once a week, or according to the software's recommended update schedule. Additionally, enable automatic updates to ensure you stay protected against the latest threats.",Malware Protection,Basic
What is the concept of least privilege and why is it important in cybersecurity?,"Least privilege is a security principle that restricts user access to the minimum necessary to perform their job functions, reducing the risk of unauthorized access or malicious activity. Implementing least privilege is crucial in preventing lateral movement and limiting the damage in case of a breach. It's essential to regularly review and adjust user permissions to ensure they align with the principle of least privilege.",Data Backup and Recovery,Intermediate
What are some best practices for securely storing and disposing of sensitive data?,"When storing sensitive data, use secure methods such as encryption, access controls, and secure storage devices. When disposing of sensitive data, use secure methods such as shredding or degaussing, and ensure that data is completely erased before disposal. Additionally, follow local and national regulations for data disposal, and consider using a secure data destruction service.",Data Backup and Recovery,Intermediate
How can I protect my mobile device from malware?,"To protect your mobile device from malware, keep your operating system and apps up to date, use a reputable antivirus app, and be cautious when downloading apps from unknown sources. Avoid using public Wi-Fi for sensitive activities, and use a VPN when browsing the internet. Also, regularly back up your data and use a secure lock screen to prevent unauthorized access.",Mobile Security,Basic
What are the best practices for securing sensitive data in the cloud?,"When storing sensitive data in the cloud, it's essential to implement access controls, encrypt data both in transit and at rest, and ensure that the cloud provider has a robust security framework in place. Additionally, use secure protocols like HTTPS and SFTP, and regularly review access logs to detect potential security threats.",Data Backup and Recovery,Intermediate
How do I prevent phishing attacks on my company's email?,"To prevent phishing attacks, educate employees on identifying suspicious emails, use email filters to block known phishing emails, and implement a two-factor authentication process for accessing sensitive company information. Regularly update software and plugins to prevent vulnerabilities, and use email clients with built-in phishing protection. ",Incident Response,Intermediate
What are the best practices for backing up company data?,"To back up company data, use a combination of cloud storage and on-site backup solutions. Regularly update backups to prevent data loss, use a backup management tool to track and monitor backups, and test backups to ensure data integrity. Use strong encryption for sensitive data, and consider implementing a backup rotation schedule. ",Data Backup and Recovery,Intermediate
How do I secure my company's mobile devices?,"To secure mobile devices, use mobile device management (MDM) software to monitor and control access to company data. Enable encryption, set up a PIN or password, and use a screen lock. Regularly update the operating system and apps to prevent vulnerabilities, and use a mobile security app to detect and prevent malware. ",Mobile Security,Intermediate
What are the benefits of using a virtual private network (VPN) for remote work?,"Using a VPN provides a secure and encrypted connection between the remote worker's device and the company's network. It helps protect against man-in-the-middle attacks, data interception, and IP spoofing. A VPN also masks the remote worker's IP address and location, making it difficult for hackers to track their activity. ",Network Security,Intermediate
How do I respond to a ransomware attack on my company's network?,"To respond to a ransomware attack, immediately disconnect the affected network segment from the rest of the network to prevent further spread. Notify your incident response team and security experts, and contain the attack by isolating the affected systems. Restore from backups, and use security software to remove malware and repair systems. ",Incident Response,Advanced
What are the best practices for securing a company's Wi-Fi network?,"To secure a Wi-Fi network, change the default router password, enable WPA3 encryption, update the firmware regularly, and create a guest network for visitors. Use strong passwords and disable WPS to prevent unauthorized access. Set up a network access control list to limit access to authorized devices and users. ",Network Security,Intermediate
